{
  "schema_version": "1.0.0",
  "id": "01J2DESKOSPLANVERSION00001",
  "workspace_id": "01J2DESKOSWORKSPACE000001",
  "version": 1,
  "lifecycle_state": "ACTIVE",
  "input_kind": "single_project",
  "objective": "Digitalizar a operação de forma simples e rastreável.",
  "dominant_result": "Desenhar e validar o fluxo digital da operação.",
  "root_node_ids": [
    "01J2DESKOSROOTPROJECT000001"
  ],
  "nodes": [
    {
      "schema_version": "1.0.0",
      "workspace_id": "01J2DESKOSWORKSPACE000001",
      "plan_version_id": "01J2DESKOSPLANVERSION00001",
      "project_id": "01J2DESKOSPROJECTCLEANSEA01",
      "description": "",
      "status": "READY",
      "done_criteria": [],
      "owner": null,
      "schedule": null,
      "dependencies": [],
      "risk": null,
      "source_refs": [
        {
          "source_artifact_id": "01J2DESKOSSOURCEARTIFACT01",
          "locator": "section:demo",
          "classification": "FACT"
        }
      ],
      "metadata": {},
      "id": "01J2DESKOSROOTPROJECT000001",
      "parent_id": null,
      "node_type": "project",
      "title": "Digitalização da operação",
      "order": 0,
      "depth": 0,
      "completion_rule": {
        "kind": "ALL_CHILDREN",
        "minimum_complete": null,
        "requires_evidence": false
      }
    },
    {
      "schema_version": "1.0.0",
      "workspace_id": "01J2DESKOSWORKSPACE000001",
      "plan_version_id": "01J2DESKOSPLANVERSION00001",
      "project_id": "01J2DESKOSPROJECTCLEANSEA01",
      "description": "",
      "status": "IN_PROGRESS",
      "done_criteria": [],
      "owner": null,
      "schedule": {
        "date": "2026-07-15",
        "week_id": "2026-W29",
        "start_at": null,
        "end_at": null
      },
      "dependencies": [],
      "risk": null,
      "source_refs": [
        {
          "source_artifact_id": "01J2DESKOSSOURCEARTIFACT01",
          "locator": "section:demo",
          "classification": "FACT"
        }
      ],
      "metadata": {},
      "id": "01J2DESKOSBLOCKTOBE0000001",
      "parent_id": "01J2DESKOSROOTPROJECT000001",
      "node_type": "block",
      "title": "Desenhar o fluxo futuro",
      "order": 0,
      "depth": 1,
      "completion_rule": {
        "kind": "ALL_CHILDREN",
        "minimum_complete": null,
        "requires_evidence": false
      }
    },
    {
      "schema_version": "1.0.0",
      "workspace_id": "01J2DESKOSWORKSPACE000001",
      "plan_version_id": "01J2DESKOSPLANVERSION00001",
      "project_id": "01J2DESKOSPROJECTCLEANSEA01",
      "description": "",
      "status": "DONE",
      "done_criteria": [
        "Lista de campos mínimos registrada"
      ],
      "owner": null,
      "schedule": null,
      "dependencies": [],
      "risk": null,
      "source_refs": [
        {
          "source_artifact_id": "01J2DESKOSSOURCEARTIFACT01",
          "locator": "section:demo",
          "classification": "FACT"
        }
      ],
      "metadata": {},
      "id": "01J2DESKOSACTIONFIELDS00001",
      "parent_id": "01J2DESKOSBLOCKTOBE0000001",
      "node_type": "action",
      "title": "Definir os campos padrão",
      "order": 0,
      "depth": 2,
      "completion_rule": {
        "kind": "MANUAL",
        "minimum_complete": null,
        "requires_evidence": true
      }
    },
    {
      "schema_version": "1.0.0",
      "workspace_id": "01J2DESKOSWORKSPACE000001",
      "plan_version_id": "01J2DESKOSPLANVERSION00001",
      "project_id": "01J2DESKOSPROJECTCLEANSEA01",
      "description": "",
      "status": "IN_PROGRESS",
      "done_criteria": [
        "Estados, responsáveis e condições de passagem registrados"
      ],
      "owner": null,
      "schedule": null,
      "dependencies": [],
      "risk": null,
      "source_refs": [
        {
          "source_artifact_id": "01J2DESKOSSOURCEARTIFACT01",
          "locator": "section:demo",
          "classification": "FACT"
        }
      ],
      "metadata": {},
      "id": "01J2DESKOSACTIONSTATUS00001",
      "parent_id": "01J2DESKOSBLOCKTOBE0000001",
      "node_type": "action",
      "title": "Definir status e responsáveis",
      "order": 1,
      "depth": 2,
      "completion_rule": {
        "kind": "MANUAL",
        "minimum_complete": null,
        "requires_evidence": false
      }
    },
    {
      "schema_version": "1.0.0",
      "workspace_id": "01J2DESKOSWORKSPACE000001",
      "plan_version_id": "01J2DESKOSPLANVERSION00001",
      "project_id": "01J2DESKOSPROJECTCLEANSEA01",
      "description": "",
      "status": "TODO",
      "done_criteria": [
        "Eventos e automações essenciais registrados"
      ],
      "owner": null,
      "schedule": null,
      "dependencies": [],
      "risk": null,
      "source_refs": [
        {
          "source_artifact_id": "01J2DESKOSSOURCEARTIFACT01",
          "locator": "section:demo",
          "classification": "FACT"
        }
      ],
      "metadata": {},
      "id": "01J2DESKOSACTIONRULES000001",
      "parent_id": "01J2DESKOSBLOCKTOBE0000001",
      "node_type": "action",
      "title": "Definir regras automáticas",
      "order": 2,
      "depth": 2,
      "completion_rule": {
        "kind": "MANUAL",
        "minimum_complete": null,
        "requires_evidence": false
      }
    },
    {
      "schema_version": "1.0.0",
      "workspace_id": "01J2DESKOSWORKSPACE000001",
      "plan_version_id": "01J2DESKOSPLANVERSION00001",
      "project_id": "01J2DESKOSPROJECTCLEANSEA01",
      "description": "",
      "status": "TODO",
      "done_criteria": [
        "Fluxo contém campos, estados, responsáveis e automações essenciais"
      ],
      "owner": null,
      "schedule": null,
      "dependencies": [],
      "risk": null,
      "source_refs": [
        {
          "source_artifact_id": "01J2DESKOSSOURCEARTIFACT01",
          "locator": "section:demo",
          "classification": "FACT"
        }
      ],
      "metadata": {},
      "id": "01J2DESKOSSYNTHESISFLOW0001",
      "parent_id": "01J2DESKOSBLOCKTOBE0000001",
      "node_type": "synthesis",
      "title": "Fluxo TO-BE validável",
      "order": 3,
      "depth": 2,
      "completion_rule": {
        "kind": "ALL_CHILDREN",
        "minimum_complete": null,
        "requires_evidence": false
      }
    }
  ],
  "validation_report": {
    "valid": true,
    "errors": [],
    "warnings": [],
    "gaps": [
      "Confirmar quem pode alterar o status de fechamento."
    ]
  },
  "source_artifact_ids": [
    "01J2DESKOSSOURCEARTIFACT01"
  ],
  "created_at": "2026-07-14T15:00:00Z",
  "created_by": "demo-user",
  "approved_at": "2026-07-14T15:10:00Z",
  "approved_by": "demo-user"
}
